Name,Slug,Collection ID,Locale ID,Item ID,Created On,Updated On,Published On,Ingredients,Image,Thumbnail image,Calories,Price,Spicy?,Vegetarian?,Vegan?
10 Quick Tips About Blogging,10-quick-tips-about-blogging,65bbdded4712648cf0ef3f07,65bbddec9f6f9a0a232854f7,65bbddffc4b9a8b55a8160ff,Thu Feb 01 2024 18:07:59 GMT+0000 (Coordinated Universal Time),Thu Feb 01 2024 18:07:59 GMT+0000 (Coordinated Universal Time),,Amet et doloremque voluptatem dolor non quis aut cupiditate aliquam. Aut accusantium id ab iste natus repellendus od,https://uploads-ssl.webflow.com/65bbddec9f6f9a0a232854f8/65bbddfec4b9a8b55a815fcb_image14.jpeg,https://uploads-ssl.webflow.com/65bbddec9f6f9a0a232854f8/65bbddfec4b9a8b55a815fc1_image6.jpeg,80145,47269,true,false,false
5 Principles Of Effective Web Design,5-principles-of-effective-web-design,65bbdded4712648cf0ef3f07,65bbddec9f6f9a0a232854f7,65bbddffc4b9a8b55a8160f8,Thu Feb 01 2024 18:07:59 GMT+0000 (Coordinated Universal Time),Thu Feb 01 2024 18:07:59 GMT+0000 (Coordinated Universal Time),,Sapiente id eveniet ut odio. Consequatur dolorum quod ipsum a debitis facere. Dolor quia ipsam consequatur. Impedit in enim et. T,https://uploads-ssl.webflow.com/65bbddec9f6f9a0a232854f8/65bbddfec4b9a8b55a815fd4_image10.jpeg,https://uploads-ssl.webflow.com/65bbddec9f6f9a0a232854f8/65bbddfec4b9a8b55a815fce_image11.jpeg,54641,4423,true,false,true
5 Web Design Blogs You Should Be Reading,5-web-design-blogs-you-should-be-reading,65bbdded4712648cf0ef3f07,65bbddec9f6f9a0a232854f7,65bbddffc4b9a8b55a8160f0,Thu Feb 01 2024 18:07:59 GMT+0000 (Coordinated Universal Time),Thu Feb 01 2024 18:07:59 GMT+0000 (Coordinated Universal Time),,Ab autem qui laboriosam sint ipsa doloremque. Et et voluptate et aspernatur perspiciatis quod commodi odio ,https://uploads-ssl.webflow.com/65bbddec9f6f9a0a232854f8/65bbddfec4b9a8b55a815fc4_image12.jpeg,https://uploads-ssl.webflow.com/65bbddec9f6f9a0a232854f8/65bbddfec4b9a8b55a815fd4_image10.jpeg,9887,66779,false,true,true
Designers Who Changed the Web,designers-who-changed-the-web,65bbdded4712648cf0ef3f07,65bbddec9f6f9a0a232854f7,65bbddffc4b9a8b55a8160f2,Thu Feb 01 2024 18:07:59 GMT+0000 (Coordinated Universal Time),Thu Feb 01 2024 18:08:45 GMT+0000 (Coordinated Universal Time),,Amet ut aliquam repellendus voluptatem sint asperiores iste mollitia omnis. Sint alias sint adipisci non sint. Ea molestiae corpori,https://uploads-ssl.webflow.com/65bbddec9f6f9a0a232854f8/65bbddfec4b9a8b55a815fe3_image1.jpeg,https://uploads-ssl.webflow.com/65bbddec9f6f9a0a232854f8/65bbddfec4b9a8b55a815fd1_image7.jpeg,54209,18619,true,false,true
The Worst Advice We've Ever Heard About Web Design,the-worst-advice-weve-ever-heard-about-web-design,65bbdded4712648cf0ef3f07,65bbddec9f6f9a0a232854f7,65bbddffc4b9a8b55a81610d,Thu Feb 01 2024 18:07:59 GMT+0000 (Coordinated Universal Time),Thu Feb 01 2024 18:07:59 GMT+0000 (Coordinated Universal Time),,Ex ducimus dolor voluptatem id voluptate enim et nesciunt. In mo,https://uploads-ssl.webflow.com/65bbddec9f6f9a0a232854f8/65bbddfec4b9a8b55a815fd7_image10.jpeg,https://uploads-ssl.webflow.com/65bbddec9f6f9a0a232854f8/65bbddfec4b9a8b55a815fc8_image15.jpeg,33840,10212,false,true,true
